{
  "schema_version": 1,
  "skill_effects": {
    "title": "Ludovic - Wreathed Eternalist",
    "skills": {
      "Ultimate": {
        "source_hash": "2a06c56476517083439f3c36030c54422d9cd75d09c1e9569790709adeb9df16",
        "is_max_known": true,
        "tiers": {
          "base": {
            "effects": [
              {
                "tier": "base",
                "targeting_label": "Single target",
                "is_max_known": true,
                "target": "ally",
                "area": "single",
                "target_count": 1,
                "type": "dot",
                "healing_type": "over_time",
                "name": "Healing over time",
                "value": [
                  {
                    "type": "percentage",
                    "value": 150.0
                  }
                ],
                "duration": 2,
                "tick": 1.0
              },
              {
                "tier": "base",
                "targeting_label": "Single target",
                "is_max_known": true,
                "target": "ally",
                "area": "single",
                "target_count": 1,
                "type": "heal",
                "healing_type": "direct",
                "name": "Direct healing",
                "value": [
                  {
                    "type": "percentage",
                    "value": 150.0
                  }
                ]
              }
            ],
            "summon_effects": [],
            "immunities": [
              {
                "type": "immunity",
                "tier": "base",
                "immunity_type": "unaffected",
                "timing": "on_skill",
                "targeting_label": "Self",
                "target": "self",
                "area": "single",
                "target_count": 1
              }
            ],
            "special_provides": [],
            "special_requires": []
          }
        }
      },
      "Skill1": {
        "source_hash": "ca7ca466cacde3ba8c3e1206da6caacae1bfcc2a962ce2341e17b437db499548",
        "is_max_known": true,
        "tiers": {
          "base": {
            "effects": [
              {
                "tier": "base",
                "targeting_label": "Single target",
                "is_max_known": true,
                "target": "enemy",
                "area": "single",
                "target_count": 1,
                "type": "dot",
                "damage_type": "hp_loss",
                "name": "HP loss",
                "label": "damage_hp_loss",
                "value": [
                  {
                    "type": "percentage",
                    "value": 65.0
                  }
                ],
                "duration": 4,
                "tick": 1.0
              }
            ],
            "summon_effects": [],
            "immunities": [],
            "special_provides": [],
            "special_requires": []
          }
        }
      },
      "Skill2": {
        "source_hash": "f999ac7392c9710a7e2083569a5714f63bb95377f646b2c090dcdfe865bfa943",
        "is_max_known": true,
        "tiers": {
          "base": {
            "effects": [
              {
                "tier": "base",
                "targeting_label": "Single target",
                "is_max_known": true,
                "target": "enemy",
                "area": "single",
                "target_count": 1,
                "type": "damage",
                "damage_type": "hp_loss",
                "name": "HP loss",
                "label": "damage_hp_loss",
                "value": [
                  {
                    "type": "percentage",
                    "value": 13.0
                  }
                ]
              }
            ],
            "summon_effects": [],
            "immunities": [],
            "special_provides": [],
            "special_requires": []
          }
        }
      },
      "Unlocks at Legendary+": {
        "source_hash": "5eeb4765561f2efcfc911dd26a16c4470d889b46fc8db7b12f58327d899abd46",
        "is_max_known": true,
        "tiers": {
          "base": {
            "effects": [
              {
                "tier": "base",
                "targeting_label": "Self",
                "is_max_known": true,
                "target": "self",
                "area": "single",
                "target_count": 1,
                "type": "buff",
                "name": "Healing",
                "value": [
                  {
                    "type": "flat",
                    "value": 18.0
                  }
                ],
                "persistence": "permanent",
                "label": "buff_healing"
              }
            ],
            "summon_effects": [],
            "immunities": [],
            "special_provides": [],
            "special_requires": []
          }
        }
      },
      "Ex. Skill": {
        "source_hash": "dd433148842023d89b6628cdb60fcda942c60f44e4bd50ad932bd9cf4132be48",
        "is_max_known": true,
        "tiers": {
          "mythic+": {
            "effects": [
              {
                "tier": "mythic+",
                "targeting_label": "Multiple targets",
                "is_max_known": true,
                "target": "ally",
                "area": "single",
                "target_count": 3,
                "type": "heal",
                "healing_type": "direct",
                "name": "Direct healing",
                "value": [
                  {
                    "type": "percentage",
                    "value": 150.0
                  }
                ]
              },
              {
                "tier": "mythic+",
                "targeting_label": "All units",
                "is_max_known": true,
                "target": "enemy",
                "area": "zone",
                "target_count": -1,
                "area_count": -1,
                "type": "damage",
                "damage_type": "magic",
                "name": "Magic",
                "label": "damage_normal",
                "value": [
                  {
                    "type": "percentage",
                    "value": 120.0
                  }
                ]
              }
            ],
            "summon_effects": [],
            "immunities": [],
            "special_provides": [],
            "special_requires": []
          }
        }
      },
      "Unlocks at Supreme+": {
        "source_hash": "e94135c524fa7dcbf4f6ea30dcf76132227988054306121811eb4335a2d44e0f",
        "is_max_known": true,
        "tiers": {
          "supreme+": {
            "effects": [
              {
                "tier": "supreme+",
                "targeting_label": "Single target",
                "is_max_known": true,
                "target": "enemy",
                "area": "single",
                "target_count": 1,
                "type": "crowd_control",
                "cc-type": "stun",
                "duration": 3.0
              },
              {
                "tier": "supreme+",
                "targeting_label": "Single target",
                "is_max_known": true,
                "target": "enemy",
                "area": "single",
                "target_count": 1,
                "type": "damage",
                "damage_type": "magic",
                "name": "Magic",
                "label": "damage_normal",
                "value": [
                  {
                    "type": "percentage",
                    "value": 120.0
                  }
                ]
              }
            ],
            "summon_effects": [],
            "immunities": [],
            "special_provides": [],
            "special_requires": []
          }
        }
      }
    }
  },
  "behavior_tags": [
    "ally-healer",
    "aoe-healing",
    "hp-loss"
  ],
  "summon_profile": null,
  "skill_summaries": {
    "ultimate": "move healing field to designated tile, restoring HP for allies within range",
    "skill1": "Passive: field healing restored when enemies lose HP; Active: deal damage and HP-loss to top attacker",
    "skill2": "move field to selected ally's position, absorbing nearby enemy HP to restore field healing",
    "skill3": "battle healing stat scales with field total healing stored",
    "skill4": "field periodically produces berries that explode, damaging enemies and healing allies within range",
    "skill5": "enemies entering field take damage and are stunned"
  },
  "play_overview": "[[Ludovic]] anchors a **movable healing field** that restores HP for allies inside and damages or stuns **enemies who enter** the zone. He shifts the field to allies or **absorbs nearby enemy HP** to refill stored healing when the pool runs low. Damage skills targeting the top attacker add **HP-loss pressure** alongside the field's passive refill when foes lose HP. Stored healing **scales his battle Healing stat**, while periodic berries **explode for damage and ally heals** in range. Field healing restores when enemies lose HP, so sustained enemy damage keeps his pool topped. He excels in **long attrition fights** with steady enemy traffic through the field. Burst that skips the field or enemies that never step inside waste his heal-damage loop.",
  "counter_overview": "[[Ludovic]] only wins if the fight drags on, so the matchup is decided by whether you can end it before his stored healing pool builds up. He is **Unaffected while generating his healing field**, so do not bank on interrupting that cast. **Lock ally healing** with [[Dunlingr]]'s Curelock or cut it with [[Gwyneth]], then pair [[filter:assassin-delete]] like [[Ravion]] or [[Evie]]; alternatively, **burst past the zone** before berries and HP-loss on your top attacker snowball. Comps that never stand in the field waste his heal-damage loop."
}
