{
  "schema_version": 1,
  "skill_effects": {
    "title": "Parisa - Ode to Flowers",
    "skills": {
      "Ultimate": {
        "source_hash": "4d161c99cafff75a7b86444930909d2b00d5b65fb71401fe8ae32d31e6971771",
        "is_max_known": true,
        "tiers": {
          "base": {
            "effects": [
              {
                "tier": "base",
                "targeting_label": "Area",
                "is_max_known": true,
                "target": "enemy",
                "area": "radius",
                "target_count": -1,
                "area_count": 1,
                "type": "damage",
                "damage_type": "magic",
                "name": "Magic",
                "label": "damage_normal",
                "value": [
                  {
                    "type": "percentage",
                    "value": 520.0
                  }
                ]
              },
              {
                "tier": "base",
                "targeting_label": "Self",
                "is_max_known": true,
                "target": "self",
                "area": "single",
                "target_count": 1,
                "conditions": [
                  {
                    "type": "trigger_condition",
                    "trigger": "defeat"
                  }
                ],
                "type": "buff",
                "name": "Energy",
                "label": "buff_stat",
                "value": [
                  {
                    "type": "flat",
                    "value": 60.0
                  }
                ],
                "duration": 5.0,
                "tick": 1.0,
                "persistence": "temporary"
              },
              {
                "tier": "base",
                "targeting_label": "Area",
                "is_max_known": true,
                "target": "enemy",
                "area": "radius",
                "target_count": -1,
                "area_count": 1,
                "type": "debuff",
                "name": "Damage dealt",
                "label": "debuff_stat",
                "value": [
                  {
                    "type": "percentage",
                    "value": 20.0
                  }
                ]
              }
            ],
            "summon_effects": [],
            "immunities": [],
            "special_provides": [
              {
                "label": "Marked target (focus fire)",
                "tier": "base",
                "targeting": "Area",
                "description": "Parisa marks a non-marked enemy with a flower until the battle ends, dealing 480% (ATK-based) damage to all floral-marked targets and other enemies within 1 tiles of them."
              }
            ],
            "special_requires": []
          }
        }
      },
      "Skill1": {
        "source_hash": "fb1a3b86b815fd19103f63ff93c880a1e3ba66002b008c8c2376e4d399c8c303",
        "is_max_known": true,
        "tiers": {
          "base": {
            "effects": [
              {
                "tier": "base",
                "targeting_label": "Multiple targets",
                "is_max_known": true,
                "target": "ally",
                "area": "single",
                "target_count": 2,
                "type": "buff",
                "name": "ATK SPD",
                "label": "buff_offensive",
                "value": [
                  {
                    "type": "flat",
                    "value": 30.0
                  }
                ],
                "duration": 10.0,
                "persistence": "temporary"
              },
              {
                "tier": "base",
                "targeting_label": "Multiple targets",
                "is_max_known": true,
                "target": "ally",
                "area": "single",
                "target_count": 2,
                "type": "buff",
                "name": "ATK",
                "label": "buff_offensive",
                "value": [
                  {
                    "type": "percentage",
                    "value": 30.0
                  }
                ],
                "duration": 10.0,
                "persistence": "temporary"
              }
            ],
            "summon_effects": [],
            "immunities": [],
            "special_provides": [],
            "special_requires": []
          }
        }
      },
      "Skill2": {
        "source_hash": "060c55e95b235444a31edaf9d109bf9213834c25f29ed9de33bd3bc484d340e3",
        "is_max_known": true,
        "tiers": {
          "base": {
            "effects": [
              {
                "tier": "base",
                "targeting_label": "Area",
                "is_max_known": true,
                "target": "enemy",
                "area": "path",
                "target_count": -1,
                "area_count": 1,
                "area_direction": "selected_target",
                "type": "damage",
                "damage_type": "magic",
                "name": "Magic",
                "label": "damage_normal",
                "value": [
                  {
                    "type": "percentage",
                    "value": 235.0
                  }
                ]
              },
              {
                "tier": "base",
                "targeting_label": "Self",
                "is_max_known": true,
                "target": "self",
                "area": "single",
                "target_count": 1,
                "type": "buff",
                "name": "Energy",
                "label": "buff_stat",
                "value": [
                  {
                    "type": "flat",
                    "value": 70.0
                  }
                ],
                "persistence": "permanent"
              }
            ],
            "summon_effects": [],
            "immunities": [],
            "special_provides": [],
            "special_requires": []
          }
        }
      },
      "Unlocks at Legendary+": {
        "source_hash": "e40e956cfd6022b08e372e2d57dc72a3302d6c0ef13d5657a69bccdd1751aacd",
        "is_max_known": true,
        "tiers": {
          "legendary+": {
            "effects": [
              {
                "tier": "legendary+",
                "targeting_label": "Self",
                "is_max_known": true,
                "target": "self",
                "area": "single",
                "target_count": 1,
                "type": "buff",
                "name": "ATK",
                "label": "buff_offensive",
                "value": [
                  {
                    "type": "percentage",
                    "value": 20.0
                  }
                ],
                "persistence": "permanent"
              }
            ],
            "summon_effects": [],
            "immunities": [],
            "special_provides": [],
            "special_requires": []
          }
        }
      },
      "Ex. Skill": {
        "source_hash": "94312a99dd3b8bfdbe89cbc206c366fff9e6b3491c1a20b50abbc9d26ed3fa46",
        "is_max_known": true,
        "tiers": {
          "mythic+": {
            "effects": [],
            "summon_effects": [],
            "immunities": [],
            "special_provides": [
              {
                "label": "Marked target (focus fire)",
                "tier": "mythic+",
                "targeting": "Single target",
                "description": "Parisa marks the nearest enemy in a symmetrical position with a flower when a battle starts."
              }
            ],
            "special_requires": []
          }
        }
      },
      "Unlocks at Supreme+": {
        "source_hash": "39b86f61e123dfced5dd99ac1b9324d6746b7f3527b70fd872fb39c17c626183",
        "is_max_known": true,
        "tiers": {
          "base": {
            "effects": [],
            "summon_effects": [],
            "immunities": [],
            "special_provides": [],
            "special_requires": []
          }
        }
      }
    }
  },
  "behavior_tags": [
    "ally-buffer",
    "aoe-damage",
    "mark-target",
    "temporary-stat-buffer"
  ],
  "summon_profile": null,
  "skill_summaries": {
    "ultimate": "mark target with flower and deal AoE damage",
    "skill1": "boost ATK speed and normal attack damage for herself and an ally",
    "skill2": "periodic line attack hitting enemies along path after several normal attacks",
    "skill3": "battle ATK increase",
    "skill4": "mark at start; normal attacks hit extra targets after accumulating marks",
    "skill5": "fewer normal attacks needed to trigger periodic line attack"
  },
  "play_overview": "[[Parisa]] marks with flowers for **AoE ultimate damage**, then boosts **attack speed and normal attack damage** for herself and one ally to accelerate their output together. Periodic line attacks sweep after several normals, battle ATK climbs, and marks at start let normals **hit extra targets after enough stacks** accumulate on the field. Fewer normals are needed to **trigger the line attack** at higher tiers, tightening her proc rhythm in longer fights. She shines beside **another high-attack ally** who can share her speed buff. Without **frequent normal attacks** or clustered marks, her line procs stay flat.",
  "counter_overview": "In PVP, [[Parisa]] is a two-body threat, because the ally she speeds up carries as much of her damage as she does. Once marks stack, the fight becomes a dual-tempo race. **Delete [[Parisa]] or her buff partner** early with [[filter:phys-backline-assassin]] like [[Ravion]] or [[Himmel]], or inhibit the pair with [[filter:backline-inhibit]] like [[Evie]] or [[Bonnie]] while you race your own carry with [[filter:energy-provider]] like [[Thador]] or [[Hugin]]."
}
