{
  "schema_version": 1,
  "skill_effects": {
    "title": "Hewynn - Tender Leaf",
    "skills": {
      "Ultimate": {
        "source_hash": "4457eb2ba605ba29f6ae48ed52f69c0472dafb0b77498b44937c0a505fb773fc",
        "is_max_known": true,
        "tiers": {
          "base": {
            "effects": [
              {
                "tier": "base",
                "targeting_label": "All units",
                "is_max_known": true,
                "target": "ally",
                "area": "zone",
                "target_count": -1,
                "area_count": -1,
                "type": "dot",
                "healing_type": "over_time",
                "name": "Healing over time",
                "value": [
                  {
                    "type": "percentage",
                    "value": 115.0
                  }
                ],
                "duration": 9,
                "tick": 1.0
              }
            ],
            "summon_effects": [],
            "immunities": [],
            "special_provides": [],
            "special_requires": []
          },
          "mythic+": {
            "effects": [],
            "summon_effects": [],
            "immunities": [
              {
                "type": "immunity",
                "tier": "mythic+",
                "immunity_type": "unaffected",
                "timing": "on_skill",
                "targeting_label": "Self",
                "target": "self",
                "area": "single",
                "target_count": 1
              }
            ],
            "special_provides": [],
            "special_requires": []
          }
        }
      },
      "Skill1": {
        "source_hash": "bbdf8066b17f777c017dc4368f84c4b9449424b748902ec8d2175ecec68badd1",
        "is_max_known": true,
        "tiers": {
          "base": {
            "effects": [
              {
                "tier": "base",
                "targeting_label": "Single target",
                "is_max_known": true,
                "target": "ally",
                "area": "single",
                "target_count": 1,
                "type": "heal",
                "healing_type": "direct",
                "name": "Direct healing",
                "value": [
                  {
                    "type": "percentage",
                    "value": 300.0
                  }
                ]
              }
            ],
            "summon_effects": [],
            "immunities": [],
            "special_provides": [],
            "special_requires": []
          }
        }
      },
      "Skill2": {
        "source_hash": "76673699eb901ca8f60780ee8f6b5fa7851deec1c189982a2721077b431015d9",
        "is_max_known": true,
        "tiers": {
          "base": {
            "effects": [
              {
                "tier": "base",
                "targeting_label": "Single target",
                "is_max_known": true,
                "target": "ally",
                "area": "single",
                "target_count": 1,
                "conditions": [
                  {
                    "type": "hp_threshold",
                    "hp_ratio": 0.5,
                    "comparison": "below"
                  }
                ],
                "type": "heal",
                "healing_type": "direct",
                "name": "Direct healing",
                "value": [
                  {
                    "type": "percentage",
                    "value": 130.0
                  }
                ]
              }
            ],
            "summon_effects": [],
            "immunities": [
              {
                "type": "immunity",
                "tier": "base",
                "immunity_type": "cleanse",
                "timing": "on_skill",
                "targeting_label": "Single target",
                "target": "ally",
                "area": "single",
                "target_count": 1
              }
            ],
            "special_provides": [],
            "special_requires": [
              {
                "label": "Passive with internal cooldown",
                "tier": "base",
                "targeting": "Allies",
                "description": "This effect can trigger once every 8 - 1s per ally."
              }
            ]
          }
        }
      },
      "Unlocks at Legendary+": {
        "source_hash": "9c86491df7b8fdb64ffd9845fe52b46959d5ae85412aa2943a6fffbb24343bb6",
        "is_max_known": true,
        "tiers": {
          "legendary+": {
            "effects": [
              {
                "tier": "legendary+",
                "targeting_label": "Self",
                "is_max_known": true,
                "target": "self",
                "area": "single",
                "target_count": 1,
                "type": "buff",
                "name": "ATK",
                "label": "buff_offensive",
                "value": [
                  {
                    "type": "percentage",
                    "value": 14.0
                  }
                ],
                "persistence": "permanent"
              }
            ],
            "summon_effects": [],
            "immunities": [],
            "special_provides": [],
            "special_requires": []
          }
        }
      },
      "Ex. Skill": {
        "source_hash": "2a671ee5a4fedabf8e6c1529de5794455907299d5609e490f04cb6a02162c4a0",
        "is_max_known": true,
        "tiers": {
          "mythic+": {
            "effects": [
              {
                "tier": "mythic+",
                "targeting_label": "All units",
                "is_max_known": true,
                "target": "ally",
                "area": "zone",
                "target_count": -1,
                "area_count": -1,
                "type": "buff",
                "name": "Damage taken",
                "label": "buff_stat",
                "value": [
                  {
                    "type": "percentage",
                    "value": 36.0
                  }
                ],
                "duration": 9,
                "persistence": "temporary"
              }
            ],
            "summon_effects": [],
            "immunities": [],
            "special_provides": [],
            "special_requires": []
          }
        }
      },
      "Unlocks at Supreme+": {
        "source_hash": "695e330f0dd50eaeb58df20185cab9cbf5b6309337e7f93615d503c263403fc5",
        "is_max_known": true,
        "tiers": {
          "supreme+": {
            "effects": [
              {
                "tier": "supreme+",
                "targeting_label": "Single target",
                "is_max_known": true,
                "target": "ally",
                "area": "single",
                "target_count": 1,
                "type": "buff",
                "name": "Haste",
                "label": "buff_offensive",
                "value": [
                  {
                    "type": "flat",
                    "value": 30.0
                  }
                ],
                "duration": 6,
                "persistence": "temporary"
              }
            ],
            "summon_effects": [],
            "immunities": [],
            "special_provides": [],
            "special_requires": []
          }
        }
      }
    }
  },
  "behavior_tags": [
    "ally-healer",
    "aoe-healing",
    "temporary-stat-buffer"
  ],
  "summon_profile": null,
  "skill_summaries": {
    "ultimate": "sustained AoE heal over time for all allies",
    "skill1": "heal a single ally",
    "skill2": "heal allies, cleansing dispellable debuffs",
    "skill3": "ATK scales after first ultimate cast",
    "skill4": "unaffected during ultimate; all allies reduce damage taken",
    "skill5": "haste boost for ally when cleansed"
  },
  "play_overview": "[[Hewynn]] sustains allies with **single-target heals** and a cleanse that strips dispellable debuffs from multiple friends. Her ultimate delivers **AoE heal over time** while she stays Unaffected and all allies gain **damage reduction** during the channel. Battle ATK rises after her **first ultimate**, and cleansed allies receive a **Haste boost** for quicker rotations through the rest of the fight. She is a reliable healer when stronger options are unavailable on the roster. Output is **modest next to top supports** and she offers little beyond healing. Fights needing **shields or hard mitigation** rather than steady regeneration underuse her kit.",
  "counter_overview": "The one window worth planning around in [[Hewynn]]'s kit is her slow ultimate, Rain Prayer, after which she is **Unaffected**. She extends fights rather than ending them — do not bank on interrupting Rain Prayer mid-channel. Outpace her modest sustain by racing your carry with [[filter:energy-provider]] like [[Thador]] or [[Hugin]], or pressure her carries with [[filter:backline-assassin]] like [[Ravion]] or [[Evie]]; [[Lily May]] can still catch the Rain Prayer wind-up before she goes Unaffected. Once her cleanses are spent, Aging packages like [[Bonnie]] stick longer into the mid-fight."
}
