{
  "schema_version": 1,
  "skill_effects": {
    "title": "Hugin - Maverick Smith",
    "skills": {
      "Ultimate": {
        "source_hash": "c8b46f5c4ed16e3b7fae199f6f17fc8e1190c1953027ac19d38a2e041066c63b",
        "is_max_known": true,
        "tiers": {
          "base": {
            "effects": [
              {
                "tier": "base",
                "targeting_label": "Single target",
                "is_max_known": true,
                "target": "ally",
                "area": "single",
                "target_count": 1,
                "type": "buff",
                "name": "ATK",
                "label": "buff_offensive",
                "persistence": "temporary"
              },
              {
                "tier": "base",
                "targeting_label": "Single target",
                "is_max_known": true,
                "target": "ally",
                "area": "single",
                "target_count": 1,
                "type": "buff",
                "name": "Haste",
                "label": "buff_offensive",
                "value": [
                  {
                    "type": "flat",
                    "value": 80.0
                  }
                ],
                "duration": 10.0,
                "persistence": "temporary"
              }
            ],
            "summon_effects": [],
            "immunities": [],
            "special_provides": [],
            "special_requires": []
          }
        }
      },
      "Skill1": {
        "source_hash": "43ee18bdcd3f9dcea5fd290b6e74182ca068e1414c97bdc928946f6662b89f16",
        "is_max_known": true,
        "tiers": {
          "base": {
            "effects": [
              {
                "tier": "base",
                "targeting_label": "Single target",
                "is_max_known": true,
                "target": "ally",
                "area": "single",
                "target_count": 1,
                "type": "shield",
                "name": "Shield",
                "value": [
                  {
                    "type": "percentage",
                    "value": 660.0
                  }
                ],
                "duration": 8.0
              }
            ],
            "summon_effects": [],
            "immunities": [],
            "special_provides": [],
            "special_requires": []
          }
        }
      },
      "Skill2": {
        "source_hash": "176b37b60f924026f135658942184b44b5e2441b667e4f71a94bbc2bd27750da",
        "is_max_known": true,
        "tiers": {
          "base": {
            "effects": [
              {
                "tier": "base",
                "targeting_label": "Single target",
                "is_max_known": true,
                "target": "ally",
                "area": "single",
                "target_count": 1,
                "type": "buff",
                "name": "ATK",
                "label": "buff_offensive",
                "persistence": "temporary",
                "zone_anchor": "fixed_tile"
              },
              {
                "tier": "base",
                "targeting_label": "Single target",
                "is_max_known": true,
                "target": "ally",
                "area": "single",
                "target_count": 1,
                "conditions": [
                  {
                    "type": "battle_phase",
                    "phase": "conditional"
                  }
                ],
                "type": "buff",
                "name": "Energy",
                "label": "buff_stat",
                "value": [
                  {
                    "type": "flat",
                    "value": 75.0
                  }
                ],
                "persistence": "temporary"
              }
            ],
            "summon_effects": [],
            "immunities": [],
            "special_provides": [],
            "special_requires": []
          }
        }
      },
      "Unlocks at Legendary+": {
        "source_hash": "e9bfdc0a9bc49eef0b1fbe861642ae3736ba11d3469e6229387e2899eb023675",
        "is_max_known": true,
        "tiers": {
          "legendary+": {
            "effects": [
              {
                "tier": "legendary+",
                "targeting_label": "Self",
                "is_max_known": true,
                "target": "self",
                "area": "single",
                "target_count": 1,
                "type": "buff",
                "name": "Haste",
                "label": "buff_offensive",
                "value": [
                  {
                    "type": "flat",
                    "value": 20.0
                  }
                ],
                "persistence": "permanent"
              }
            ],
            "summon_effects": [],
            "immunities": [],
            "special_provides": [],
            "special_requires": []
          }
        }
      },
      "Ex. Skill": {
        "source_hash": "c32edff81888eb937bbe018ad2ebc99cc699146928f74b6d0fd22f950158fcdb",
        "is_max_known": true,
        "tiers": {
          "mythic+": {
            "effects": [
              {
                "tier": "mythic+",
                "targeting_label": "Multiple targets",
                "is_max_known": true,
                "target": "ally",
                "area": "single",
                "target_count": 2,
                "type": "shield",
                "name": "Shield",
                "value": [
                  {
                    "type": "percentage",
                    "value": 900.0
                  }
                ],
                "duration": 8.0
              }
            ],
            "summon_effects": [],
            "immunities": [
              {
                "type": "immunity",
                "tier": "ex+10",
                "immunity_type": "unaffected",
                "timing": "conditional",
                "targeting_label": "Multiple targets",
                "target": "ally",
                "area": "single",
                "target_count": 2
              }
            ],
            "special_provides": [],
            "special_requires": []
          }
        }
      },
      "Unlocks at Supreme+": {
        "source_hash": "2138dba6890c8a134935079902ee385b5a90c1a9f99f5f557de9e7c57d184337",
        "is_max_known": true,
        "tiers": {
          "supreme+": {
            "effects": [
              {
                "tier": "supreme+",
                "targeting_label": "Single target",
                "is_max_known": true,
                "target": "ally",
                "area": "single",
                "target_count": 1,
                "conditions": [
                  {
                    "type": "status_condition",
                    "status": "active_shield"
                  }
                ],
                "type": "buff",
                "name": "Damage taken",
                "label": "buff_stat",
                "value": [
                  {
                    "type": "percentage",
                    "value": 30.0
                  }
                ],
                "persistence": "temporary"
              }
            ],
            "summon_effects": [],
            "immunities": [],
            "special_provides": [],
            "special_requires": []
          }
        }
      }
    }
  },
  "behavior_tags": [
    "ally-shielder",
    "energy-provider",
    "high-initial-energy",
    "static-tile-buffer",
    "temporary-stat-buffer"
  ],
  "summon_profile": null,
  "skill_summaries": {
    "ultimate": "boost ATK and Haste of the ally with highest cumulative damage",
    "skill1": "large shield granted to weakest ally",
    "skill2": "boost ATK of ally directly behind; that ally recovers energy when caster shields",
    "skill3": "battle haste increase",
    "skill4": "ultimate also grants shields to weakest allies",
    "skill5": "shielded allies reduce their damage taken"
  },
  "play_overview": "[[Hugin]] shields the **weakest ally** with large barriers, then boosts the **highest cumulative damage dealer's ATK and Haste** on ultimate. The ally directly behind gains **ATK**, and recovers Energy whenever he shields anyone on the field. Shielded allies also **reduce damage taken**, and his ultimate adds shields to weak targets alongside the buff. He is a **strong buffer for a rear carry** positioned behind him on the board. Value drops when the **rear partner dies** or when no ally clearly leads damage dealt. He adds **little personal damage** if buff targets are misaligned or the top dealer changes mid-fight.",
  "counter_overview": "[[Hugin]]'s ultimate comes early on a fast first cast, so the buff reaches their top damage dealer almost at once. The matchup hinges on whether that **buffed carry** snowballs, not on killing [[Hugin]] through shields. **Shove the ally parked behind him off its tile** with [[Eironn]] so the mid-fight buff drops, or delete/inhibit the partner and top dealer with [[filter:backline-inhibit]] like [[Evie]] or [[Bonnie]] before the buff locks in. Race your own carry with [[filter:energy-provider]] like [[Thador]] or [[Rowan]]."
}
